{
  "checkpoint_ref": null,
  "created_at": "2026-10-25T12:00:00.000Z",
  "expires_at": "2026-10-25T12:10:00.000Z",
  "kind": "inference_session",
  "model_hash": "sha256:f4daee3297421b9155d7cb0e198c10f21911cfe38d10f4ff3adec9a401d5ba6d",
  "schema_version": "liquid-agent/v1",
  "sequence_index": -1,
  "session_id": "sess-fixture-1",
  "state": "active",
  "ttl_s": 600,
  "worker": "local"
}
